id,submission_time,view_number,vote_number,title,message,image
0,1576828645,69,9,How to make lists in Python?,"I am totally new to this, any hints?",uploaded-image/
1,1576758615,13,0,Monday,What did we do on monday?,uploaded-image/1.gif
2,1576759297,11,0,Tuesday,What did we do on tuesday?,uploaded-image/2.gif
3,1576759594,3,0,Wednesday,What did we do on wednesday?,uploaded-image/3.gif
4,1576759851,4,0,Thursday,The million dollar question.,uploaded-image/4.gif
5,1576760308,5,0,Friday,Plans?,uploaded-image/5.gif
